{"attention_required": true, "command": "verify", "data": {"report": {"findings": [{"code": "materialization_not_current", "details": {"drift": false, "input_revision": "546c5cbbaf757bf950378556e65d5a4f5ae9f84072abd3363d5eb78a2f504218", "needs_materialization": true, "outdated": false, "owner_ref": "resource://architecture/overview", "registered": true, "renderer": "markdown", "renderer_revision": "builtin:markdown:v1", "state": "unmaterialized"}, "message": "generated view state is unmaterialized", "severity": "blocking", "target": "file://architecture/overview.md"}, {"code": "materialization_not_current", "details": {"drift": false, "error": "derived materialization requires a recorded build receipt before rendering: resource://architecture/system_summary", "needs_materialization": false, "outdated": false, "owner_ref": "resource://architecture/system_summary", "registered": true, "renderer": "markdown", "state": "error"}, "message": "generated view state is error", "severity": "blocking", "target": "file://architecture/system_summary.md"}, {"code": "materialization_not_current", "details": {"drift": false, "input_revision": "c3f9b20056347ac2a11cde64cc95fa259704424019fa44f2433fa65f979663ab", "needs_materialization": true, "outdated": false, "owner_ref": "resource://policies/method_policy", "registered": true, "renderer": "markdown", "renderer_revision": "builtin:markdown:v1", "state": "unmaterialized"}, "message": "generated view state is unmaterialized", "severity": "blocking", "target": "file://policies/method_policy.md"}, {"code": "required_builder_unrecorded", "message": "derived target has no active build receipt", "severity": "blocking", "target": "resource://architecture/system_summary"}, {"code": "semantic_review_required", "details": {"reason_codes": ["initial_dependency", "initial_validation_required"], "rule_id": "architecture.rationale-method-policy"}, "message": "semantic target is review_required", "severity": "blocking", "target": "file://architecture/rationale.md"}], "ok": false, "sections": {"current_checks": [], "dependency_integrity": {"issues": [], "ok": true, "receipt_count": 0}, "dependency_state": {"counts": {}, "generated_at": null, "targets": {}}, "materialization": {"drifted": 0, "errors": 1, "needs_materialization": 2, "orphans": [], "outdated": 0, "outputs": [{"drift": false, "input_revision": "546c5cbbaf757bf950378556e65d5a4f5ae9f84072abd3363d5eb78a2f504218", "needs_materialization": true, "outdated": false, "owner_ref": "resource://architecture/overview", "path": "architecture/overview.md", "registered": true, "renderer": "markdown", "renderer_revision": "builtin:markdown:v1", "state": "unmaterialized"}, {"drift": false, "error": "derived materialization requires a recorded build receipt before rendering: resource://architecture/system_summary", "needs_materialization": false, "outdated": false, "owner_ref": "resource://architecture/system_summary", "path": "architecture/system_summary.md", "registered": true, "renderer": "markdown", "state": "error"}, {"drift": false, "input_revision": "c3f9b20056347ac2a11cde64cc95fa259704424019fa44f2433fa65f979663ab", "needs_materialization": true, "outdated": false, "owner_ref": "resource://policies/method_policy", "path": "policies/method_policy.md", "registered": true, "renderer": "markdown", "renderer_revision": "builtin:markdown:v1", "state": "unmaterialized"}], "unresolved_orphans": 0}, "required_builders": [{"audit_complete": true, "output_digest": "8280937b5ac0b8ef86f936343319444a7ce9204a42cfbf4e2ce8bcab7e2a773b", "recorded_receipt_id": null, "status": "build_required", "target": "resource://architecture/system_summary"}], "semantic_rules": [{"review_context_id": "reviewctx-a31cb1d0a074e9331dd5408354bc829480dc131f9e2828f7dee6783bda01250f", "rule_id": "architecture.rationale-method-policy", "status": "review_required", "target": "file://architecture/rationale.md"}]}, "summary": {"blocking_findings": 5, "total_findings": 5, "warnings": 0}}, "roots": {"documentation_root": "/mnt/data/docengine_p6_clean_projects/sample_blocked/docs", "project_root": "/mnt/data/docengine_p6_clean_projects/sample_blocked", "source": "explicit"}}, "errors": [], "meta": {"engine_version": "0.1.0.dev12", "exit_code": 3, "status": "verification_failed"}, "ok": false, "schema_version": "2.0.0", "warnings": []}
