{"attention_required": false, "command": "migrate", "data": {"changed": true, "event": {"event_id": "migration-6d5fc258-5e57-4077-941b-dab770343e89", "event_schema_version": "1.0.0", "from_version": "legacy-p6-unmarked", "migration_id": "p6-unmarked-to-runtime-layout-1", "preserved_evidence_digest": "sha256:f66cff7bce40c61c055f8f30e7a403a8d0cdb2bcdea6611feda5730a62cf1c87", "preserved_file_count": 6, "recorded_at": "2026-10-02T06:02:25.128691Z", "to_version": "1.0.0"}, "from_version": "legacy-p6-unmarked", "migration_id": "p6-unmarked-to-runtime-layout-1", "preserved_evidence_digest": "sha256:f66cff7bce40c61c055f8f30e7a403a8d0cdb2bcdea6611feda5730a62cf1c87", "preserved_files": [{"path": "baselines/sha256-c4d00bc067e647f54f5539b9e88a517c521b3ee117680cfc4d3709ccbcd20bc6.json", "sha256": "sha256:08da53e73e8f34dc4f8170db4766332a1f849c845692e66bbc129d43cf08ea7f"}, {"path": "baselines/sha256-d241f78685057b1456a6b237578922164c22d3ba3b10ed6ef8d10c497e9888fd.json", "sha256": "sha256:570f20ce1a8ff70822663a12ceb5bf29e6ac656d0f987ee609738a61d4cfd7dd"}, {"path": "events/dependency_events.jsonl", "sha256": "sha256:e0d788b59f7baf19a13b684c6bb5a303cbc61a9b502fb7a196692b83c85f5563"}, {"path": "receipts/receipt-7ec1b38016c179027b2697a77751343e75b384326f4fab1ad67975244ec1ea4d.json", "sha256": "sha256:710bb7f4d9c2c355fe93cc91ff1e77edc102c5b4f0fade396d79bef6e4dbb096"}, {"path": "state/dependency_state.json", "sha256": "sha256:7bd876fa00aa98a4a01891ad3537f96c73e69e7dfd08838db9d627f5070605ee"}, {"path": "state/materialization_state.json", "sha256": "sha256:abb4ad99fcd484c56ad834a9b7f61b4fcc6488e5ce869abc372066b73d79135a"}], "roots": {"documentation_root": "/mnt/data/docengine_p7_final_projects/migrate/docs", "project_root": "/mnt/data/docengine_p7_final_projects/migrate", "source": "explicit"}, "to_version": "1.0.0"}, "errors": [], "meta": {"engine_version": "0.1.0.dev14", "exit_code": 0, "status": "migrated"}, "ok": true, "schema_version": "2.0.0", "warnings": []}
