{"attention_required": true, "command": "check", "data": {"checked": 1, "counts": {"invalid": 1}, "results": [{"diff": {"changed": true, "changed_dependencies": ["builder://catalog.price_with_tax"], "dependencies": [{"changed": true, "current_revision": null, "error": "project package import exited: installed-systemexit-probe", "kind": "builder_revision", "reason": "builder_unavailable", "source": "builder://catalog.price_with_tax", "validated_revision": "sha256:2ad5a927954472cc7d324378a04e616c83ede0251f86ae18e590c9f10128ed43"}, {"baseline_hash": "sha256:d241f78685057b1456a6b237578922164c22d3ba3b10ed6ef8d10c497e9888fd", "changed": false, "comparator": "exact", "current_source_kind": "raw", "current_version": "ad57366865126e55649ecb23ae1d48887544976efea46a48eb5d85a6eeb4d306", "details": {}, "granularity": "field", "snapshot_ref": "baseline://sha256/d241f78685057b1456a6b237578922164c22d3ba3b10ed6ef8d10c497e9888fd", "source": "resource://catalog/product#/price", "source_kind": "raw", "validated_version": "ad57366865126e55649ecb23ae1d48887544976efea46a48eb5d85a6eeb4d306"}, {"baseline_hash": "sha256:c4d00bc067e647f54f5539b9e88a517c521b3ee117680cfc4d3709ccbcd20bc6", "changed": false, "comparator": "exact", "current_source_kind": "raw", "current_version": "44896b09365746b5f7167ee4d64988a38f7f4628803cbf86224e74eeb7c69e9d", "details": {}, "granularity": "field", "snapshot_ref": "baseline://sha256/c4d00bc067e647f54f5539b9e88a517c521b3ee117680cfc4d3709ccbcd20bc6", "source": "resource://catalog/tax_policy#/rate", "source_kind": "raw", "validated_version": "44896b09365746b5f7167ee4d64988a38f7f4628803cbf86224e74eeb7c69e9d"}], "dependency_type": "compute", "reason_codes": ["builder_unavailable"], "receipt_id": "receipt-7ec1b38016c179027b2697a77751343e75b384326f4fab1ad67975244ec1ea4d", "target": "resource://catalog/price_with_tax", "target_revision": null}, "state_changed": true, "status": "invalid", "target": "resource://catalog/price_with_tax"}], "roots": {"documentation_root": "/tmp/tmp.QzsipqoOR8/project/docs", "project_root": "/tmp/tmp.QzsipqoOR8/project", "source": "explicit"}, "runtime_diagnostics": [{"code": "builder_registry_unavailable", "message": "project package import exited: installed-systemexit-probe"}]}, "errors": [], "meta": {"engine_version": "0.1.0.dev13", "exit_code": 3, "status": "current_project_code_unavailable"}, "ok": false, "schema_version": "2.0.0", "warnings": []}
