{"attention_required": false, "command": "verify", "data": {"report": {"findings": [], "ok": true, "sections": {"current_checks": [{"changed_dependencies": [], "kind": "semantic", "reason_codes": [], "status": "valid", "target": "file://architecture/rationale.md"}, {"changed_dependencies": [], "kind": "dependency", "reason_codes": [], "status": "valid", "target": "resource://architecture/system_summary"}], "dependency_integrity": {"issues": [], "ok": true, "receipt_count": 2}, "dependency_runtime": {"ok": true}, "dependency_state": {"counts": {"valid": 2}, "generated_at": "2026-10-02T07:08:38.849741Z", "targets": {"file://architecture/rationale.md": {"changed_dependencies": [], "last_receipt_id": "receipt-e75051f2e700fb4b5a4ac4217c1d9eb2444771c3c818c9cb85640660504bd92f", "reason_codes": [], "status": "valid"}, "resource://architecture/system_summary": {"changed_dependencies": [], "last_receipt_id": "receipt-f4855ccad64a3c4ee45a038ff909b736c3c81804cf8257f637e5b5cb9ee4c706", "reason_codes": [], "status": "valid"}}}, "hardening": {"migration": {"current": true, "event_count": 1, "marker": {"initialized_at": "2026-10-02T07:08:38.044763Z", "initialized_from_empty": true, "runtime_layout_version": "1.0.0"}, "migration_required": false, "target_version": "1.0.0", "version": "1.0.0"}, "pending_transactions": [], "recovery_event_count": 0}, "materialization": {"drifted": 0, "errors": 0, "needs_materialization": 0, "orphans": [], "outdated": 0, "outputs": [{"current_digest": "sha256:123a8ecc1aceb2fc298c5e7a456ecc0605aaeb9c5af94eccaa1b9892224e9d25", "drift": false, "expected_digest": "sha256:123a8ecc1aceb2fc298c5e7a456ecc0605aaeb9c5af94eccaa1b9892224e9d25", "input_revision": "546c5cbbaf757bf950378556e65d5a4f5ae9f84072abd3363d5eb78a2f504218", "needs_materialization": false, "outdated": false, "owner_ref": "resource://architecture/overview", "path": "architecture/overview.md", "registered": true, "renderer": "markdown", "renderer_revision": "builtin:markdown:v1", "state": "current"}, {"current_digest": "sha256:0f6885d6dc37bdc5e43eb1be70f990a83af8d5e50c65ed02eb8c1cab6eaf4eb2", "drift": false, "expected_digest": "sha256:0f6885d6dc37bdc5e43eb1be70f990a83af8d5e50c65ed02eb8c1cab6eaf4eb2", "input_revision": "8280937b5ac0b8ef86f936343319444a7ce9204a42cfbf4e2ce8bcab7e2a773b", "needs_materialization": false, "outdated": false, "owner_ref": "resource://architecture/system_summary", "path": "architecture/system_summary.md", "registered": true, "renderer": "markdown", "renderer_revision": "builtin:markdown:v1", "state": "current"}, {"current_digest": "sha256:002576ad11def446ef7123a0d1ccf61df8440707eef9e45432a6b99a8bad524e", "drift": false, "expected_digest": "sha256:002576ad11def446ef7123a0d1ccf61df8440707eef9e45432a6b99a8bad524e", "input_revision": "c3f9b20056347ac2a11cde64cc95fa259704424019fa44f2433fa65f979663ab", "needs_materialization": false, "outdated": false, "owner_ref": "resource://policies/method_policy", "path": "policies/method_policy.md", "registered": true, "renderer": "markdown", "renderer_revision": "builtin:markdown:v1", "state": "current"}], "unresolved_orphans": 0}, "required_builders": [{"audit_complete": true, "output_digest": "8280937b5ac0b8ef86f936343319444a7ce9204a42cfbf4e2ce8bcab7e2a773b", "recorded_receipt_id": "receipt-f4855ccad64a3c4ee45a038ff909b736c3c81804cf8257f637e5b5cb9ee4c706", "status": "valid", "target": "resource://architecture/system_summary"}], "semantic_rules": [{"review_context_id": "reviewctx-b9d0432b351192a217e22f88cffe7e4d84814c80b96aa7ffdefcf9c5757c8780", "rule_id": "architecture.rationale-method-policy", "status": "valid", "target": "file://architecture/rationale.md"}]}, "summary": {"blocking_findings": 0, "total_findings": 0, "warnings": 0}}, "roots": {"documentation_root": "/mnt/data/docengine_p8_final_projects/sample/docs", "project_root": "/mnt/data/docengine_p8_final_projects/sample", "source": "explicit"}}, "errors": [], "meta": {"engine_version": "0.1.0.dev16", "exit_code": 0, "status": "verified"}, "ok": true, "schema_version": "2.0.0", "warnings": []}
