{"attention_required": true, "command": "sync", "data": {"acknowledged_orphaned_materializations": [], "attention_targets": ["file://architecture/rationale.md"], "final_check": {"checked": 2, "counts": {"review_required": 1, "valid": 1}, "results": [{"diff": {"changed": true, "changed_dependencies": ["resource://policies/method_policy#/allowed_methods"], "reason_codes": ["initial_dependency", "initial_validation_required"], "target": "file://architecture/rationale.md"}, "registered_rule_unvalidated": true, "review_context_id": "reviewctx-a31cb1d0a074e9331dd5408354bc829480dc131f9e2828f7dee6783bda01250f", "state_changed": false, "status": "review_required", "target": "file://architecture/rationale.md"}, {"diff": {"changed": false, "changed_dependencies": [], "dependencies": [{"baseline_hash": "sha256:269384f9843b5f39573e5e65daf0aa0c1ffdf2a09051cbe84cb59567d80e51e8", "changed": false, "comparator": "exact", "current_source_kind": "raw", "current_version": "a4584dcc35db9b04ac02acc3a2655e6d7390d20b05de7083529bae2562cd9c70", "details": {}, "granularity": "field", "snapshot_ref": "baseline://sha256/269384f9843b5f39573e5e65daf0aa0c1ffdf2a09051cbe84cb59567d80e51e8", "source": "resource://architecture/overview#/title", "source_kind": "raw", "validated_version": "a4584dcc35db9b04ac02acc3a2655e6d7390d20b05de7083529bae2562cd9c70"}, {"baseline_hash": "sha256:cbbbf3a61731a5dc8a3cf740f1a5459caba4f03c44599a88a2dd2d280c0548cc", "changed": false, "comparator": "exact", "current_source_kind": "raw", "current_version": "9cc97ae5dc70a3abe20ca11caf0f1e6848bd7a57811f9548b665c93fcf1ab3f5", "details": {}, "granularity": "field", "snapshot_ref": "baseline://sha256/cbbbf3a61731a5dc8a3cf740f1a5459caba4f03c44599a88a2dd2d280c0548cc", "source": "resource://policies/method_policy#/allowed_methods", "source_kind": "raw", "validated_version": "9cc97ae5dc70a3abe20ca11caf0f1e6848bd7a57811f9548b665c93fcf1ab3f5"}], "dependency_type": "aggregate", "reason_codes": [], "receipt_id": "receipt-f4855ccad64a3c4ee45a038ff909b736c3c81804cf8257f637e5b5cb9ee4c706", "target": "resource://architecture/system_summary", "target_revision": null}, "state_changed": false, "status": "valid", "target": "resource://architecture/system_summary"}]}, "initial_check": {"checked": 1, "counts": {"review_required": 1}, "results": [{"diff": {"changed": true, "changed_dependencies": ["resource://policies/method_policy#/allowed_methods"], "reason_codes": ["initial_dependency", "initial_validation_required"], "target": "file://architecture/rationale.md"}, "registered_rule_unvalidated": true, "review_context_id": "reviewctx-a31cb1d0a074e9331dd5408354bc829480dc131f9e2828f7dee6783bda01250f", "state_changed": false, "status": "review_required", "target": "file://architecture/rationale.md"}]}, "invalid_targets": [], "materialization": {"results": [{"input_revision": "546c5cbbaf757bf950378556e65d5a4f5ae9f84072abd3363d5eb78a2f504218", "output_digest": "sha256:123a8ecc1aceb2fc298c5e7a456ecc0605aaeb9c5af94eccaa1b9892224e9d25", "owner_ref": "resource://architecture/overview", "path": "architecture/overview.md", "renderer": "markdown", "state_record_changed": true, "written": false}, {"input_revision": "8280937b5ac0b8ef86f936343319444a7ce9204a42cfbf4e2ce8bcab7e2a773b", "output_digest": "sha256:0f6885d6dc37bdc5e43eb1be70f990a83af8d5e50c65ed02eb8c1cab6eaf4eb2", "owner_ref": "resource://architecture/system_summary", "path": "architecture/system_summary.md", "renderer": "markdown", "state_record_changed": true, "written": false}, {"input_revision": "c3f9b20056347ac2a11cde64cc95fa259704424019fa44f2433fa65f979663ab", "output_digest": "sha256:002576ad11def446ef7123a0d1ccf61df8440707eef9e45432a6b99a8bad524e", "owner_ref": "resource://policies/method_policy", "path": "policies/method_policy.md", "renderer": "markdown", "state_record_changed": true, "written": false}], "state_changed": true, "state_revision": 1, "written": 0}, "migration_before_command": {"changed": true, "event": {"action": "initialized_runtime_layout", "event_id": "migration-d32b93ca-3637-48fd-8360-d949d19a682b", "event_schema_version": "1.0.0", "from_version": null, "preserved_file_count": 0, "recorded_at": "2026-10-02T07:48:55.855658Z", "to_version": "1.0.0"}, "from_version": null, "initialized_from_empty": true, "preserved_files": [], "to_version": "1.0.0"}, "mixed_sccs": [], "ok": true, "orphaned_materializations": [], "rebuilt": [{"audit_complete": true, "output_digest": "8280937b5ac0b8ef86f936343319444a7ce9204a42cfbf4e2ce8bcab7e2a773b", "receipt_id": "receipt-f4855ccad64a3c4ee45a038ff909b736c3c81804cf8257f637e5b5cb9ee4c706", "status": "valid", "target": "resource://architecture/system_summary"}], "roots": {"documentation_root": "/mnt/data/docengine_v025_final_projects/sample/docs", "project_root": "/mnt/data/docengine_v025_final_projects/sample", "source": "explicit"}, "status": "attention_required", "unresolved_builds": []}, "errors": [], "meta": {"engine_version": "0.1.0.dev17", "exit_code": 2, "status": "attention_required"}, "ok": true, "schema_version": "2.0.0", "warnings": []}
