{"attention_required": false, "command": "validate", "data": {"actor_kind": "ai", "actor_label": null, "decision": "still-valid", "duplicate": false, "event": {"changed_dependencies": ["resource://policies/method_policy#/allowed_methods"], "event_id": "event-d39ff6598dd9f800fd32c0ba8049215f00da27b503b82833acff6bd6b45639b5", "event_type": "semantic_validation", "reason_codes": ["initial_dependency", "initial_validation_required", "semantic_still-valid"], "receipt_id": "receipt-e75051f2e700fb4b5a4ac4217c1d9eb2444771c3c818c9cb85640660504bd92f", "recorded_at": "2026-10-02T04:38:22.504668Z", "review": {"actor_kind": "ai", "context_id": "reviewctx-a31cb1d0a074e9331dd5408354bc829480dc131f9e2828f7dee6783bda01250f", "decision": "still-valid", "evidence": [], "prior_receipt_id": null, "reason": "final clean venv P6 review", "rule_id": "architecture.rationale-method-policy", "rule_revision": "sha256:22bdf65003620c83f65971aaa950504dd4e4daffde646204e5ddbceeb1ce58c9"}, "state_revision": 2, "status": "valid", "target": "file://architecture/rationale.md"}, "evidence": [], "prior_receipt_id": null, "reason": "final clean venv P6 review", "receipt_id": "receipt-e75051f2e700fb4b5a4ac4217c1d9eb2444771c3c818c9cb85640660504bd92f", "review_context_id": "reviewctx-a31cb1d0a074e9331dd5408354bc829480dc131f9e2828f7dee6783bda01250f", "roots": {"documentation_root": "/mnt/data/docengine_p6_final_projects/sample/docs", "project_root": "/mnt/data/docengine_p6_final_projects/sample", "source": "explicit"}, "status": "valid", "target": "file://architecture/rationale.md"}, "errors": [], "meta": {"engine_version": "0.1.0.dev12", "exit_code": 0, "status": "validated"}, "ok": true, "schema_version": "2.0.0", "warnings": []}
