{"attention_required": false, "command": "recover", "data": {"pending_before": 1, "recovered": [{"action": "rolled_back_interrupted_transaction", "conflict_paths": [], "event_id": "recovery-1d45dc36-5b8d-454f-93b9-7d767ff3afc4", "event_schema_version": "1.0.0", "forced": false, "operation": "rebuild", "recovered_at": "2026-10-02T06:01:06.640066Z", "restored_paths": ["_dependency/baselines/sha256-159facc1e6f7dbe2416883f122d98647b3c18ef02cef98555389184e520e5b86.json", "_dependency/events/dependency_events.jsonl", "_dependency/receipts/receipt-23cb56c285587713d0e024e01a113795528acae0ea3397ca412402abd36283e7.json", "_dependency/state/dependency_state.json"], "transaction_id": "txn-8a3d7369-2a2c-4d85-acaf-34f8e77fa22e"}], "remaining": 0, "roots": {"documentation_root": "/mnt/data/docengine_p7_clean_projects/crash/docs", "project_root": "/mnt/data/docengine_p7_clean_projects/crash", "source": "explicit"}}, "errors": [], "meta": {"engine_version": "0.1.0.dev14", "exit_code": 0, "status": "recovered"}, "ok": true, "schema_version": "2.0.0", "warnings": []}
