{"attention_required": false, "command": "recover", "data": {"pending_before": 1, "recovered": [{"action": "rolled_back_interrupted_transaction", "conflict_paths": [], "event_id": "recovery-29fe2745-7059-4b6c-857f-004d10b8d2ba", "event_schema_version": "1.0.0", "forced": false, "operation": "rebuild", "recovered_at": "2026-10-02T06:02:26.748535Z", "restored_paths": ["_dependency/baselines/sha256-e0e030707b42c18dae9d414861c664e88bab14f21c4583d30a2327bcae597d92.json", "_dependency/events/dependency_events.jsonl", "_dependency/receipts/receipt-91626084a02f10ba834c0f67f3a48b7f7befee39f2986676bd06c4fafa8a0860.json", "_dependency/state/dependency_state.json"], "transaction_id": "txn-dc20b58b-552f-4214-9890-4754566085a9"}], "remaining": 0, "roots": {"documentation_root": "/mnt/data/docengine_p7_final_projects/crash/docs", "project_root": "/mnt/data/docengine_p7_final_projects/crash", "source": "explicit"}}, "errors": [], "meta": {"engine_version": "0.1.0.dev14", "exit_code": 0, "status": "recovered"}, "ok": true, "schema_version": "2.0.0", "warnings": []}
