{"attention_required": false, "command": "sync", "data": {"acknowledged_orphaned_materializations": [], "attention_targets": [], "final_check": {"checked": 2, "counts": {"valid": 2}, "results": [{"diff": {"changed": false, "changed_dependencies": [], "dependencies": [{"baseline_hash": "sha256:cbbbf3a61731a5dc8a3cf740f1a5459caba4f03c44599a88a2dd2d280c0548cc", "changed": false, "comparator": "set", "current_source_kind": "raw", "current_version": "9cc97ae5dc70a3abe20ca11caf0f1e6848bd7a57811f9548b665c93fcf1ab3f5", "details": {}, "granularity": "field", "snapshot_ref": "baseline://sha256/cbbbf3a61731a5dc8a3cf740f1a5459caba4f03c44599a88a2dd2d280c0548cc", "source": "resource://policies/method_policy#/allowed_methods", "source_kind": "raw", "validated_version": "9cc97ae5dc70a3abe20ca11caf0f1e6848bd7a57811f9548b665c93fcf1ab3f5"}], "dependency_type": "semantic_review", "reason_codes": [], "receipt_id": "receipt-e75051f2e700fb4b5a4ac4217c1d9eb2444771c3c818c9cb85640660504bd92f", "target": "file://architecture/rationale.md", "target_revision": {"changed": false, "current_revision": "c90a6d459b920ddee94544dad323bc2de30ec321d812239bf083c4063db75c36", "validated_revision": "c90a6d459b920ddee94544dad323bc2de30ec321d812239bf083c4063db75c36"}}, "state_changed": false, "status": "valid", "target": "file://architecture/rationale.md"}, {"diff": {"changed": false, "changed_dependencies": [], "dependencies": [{"baseline_hash": "sha256:269384f9843b5f39573e5e65daf0aa0c1ffdf2a09051cbe84cb59567d80e51e8", "changed": false, "comparator": "exact", "current_source_kind": "raw", "current_version": "a4584dcc35db9b04ac02acc3a2655e6d7390d20b05de7083529bae2562cd9c70", "details": {}, "granularity": "field", "snapshot_ref": "baseline://sha256/269384f9843b5f39573e5e65daf0aa0c1ffdf2a09051cbe84cb59567d80e51e8", "source": "resource://architecture/overview#/title", "source_kind": "raw", "validated_version": "a4584dcc35db9b04ac02acc3a2655e6d7390d20b05de7083529bae2562cd9c70"}, {"baseline_hash": "sha256:cbbbf3a61731a5dc8a3cf740f1a5459caba4f03c44599a88a2dd2d280c0548cc", "changed": false, "comparator": "exact", "current_source_kind": "raw", "current_version": "9cc97ae5dc70a3abe20ca11caf0f1e6848bd7a57811f9548b665c93fcf1ab3f5", "details": {}, "granularity": "field", "snapshot_ref": "baseline://sha256/cbbbf3a61731a5dc8a3cf740f1a5459caba4f03c44599a88a2dd2d280c0548cc", "source": "resource://policies/method_policy#/allowed_methods", "source_kind": "raw", "validated_version": "9cc97ae5dc70a3abe20ca11caf0f1e6848bd7a57811f9548b665c93fcf1ab3f5"}], "dependency_type": "aggregate", "reason_codes": [], "receipt_id": "receipt-f4855ccad64a3c4ee45a038ff909b736c3c81804cf8257f637e5b5cb9ee4c706", "target": "resource://architecture/system_summary", "target_revision": null}, "state_changed": false, "status": "valid", "target": "resource://architecture/system_summary"}]}, "initial_check": {"checked": 2, "counts": {"valid": 2}, "results": [{"diff": {"changed": false, "changed_dependencies": [], "dependencies": [{"baseline_hash": "sha256:cbbbf3a61731a5dc8a3cf740f1a5459caba4f03c44599a88a2dd2d280c0548cc", "changed": false, "comparator": "set", "current_source_kind": "raw", "current_version": "9cc97ae5dc70a3abe20ca11caf0f1e6848bd7a57811f9548b665c93fcf1ab3f5", "details": {}, "granularity": "field", "snapshot_ref": "baseline://sha256/cbbbf3a61731a5dc8a3cf740f1a5459caba4f03c44599a88a2dd2d280c0548cc", "source": "resource://policies/method_policy#/allowed_methods", "source_kind": "raw", "validated_version": "9cc97ae5dc70a3abe20ca11caf0f1e6848bd7a57811f9548b665c93fcf1ab3f5"}], "dependency_type": "semantic_review", "reason_codes": [], "receipt_id": "receipt-e75051f2e700fb4b5a4ac4217c1d9eb2444771c3c818c9cb85640660504bd92f", "target": "file://architecture/rationale.md", "target_revision": {"changed": false, "current_revision": "c90a6d459b920ddee94544dad323bc2de30ec321d812239bf083c4063db75c36", "validated_revision": "c90a6d459b920ddee94544dad323bc2de30ec321d812239bf083c4063db75c36"}}, "state_changed": false, "status": "valid", "target": "file://architecture/rationale.md"}, {"diff": {"changed": false, "changed_dependencies": [], "dependencies": [{"baseline_hash": "sha256:269384f9843b5f39573e5e65daf0aa0c1ffdf2a09051cbe84cb59567d80e51e8", "changed": false, "comparator": "exact", "current_source_kind": "raw", "current_version": "a4584dcc35db9b04ac02acc3a2655e6d7390d20b05de7083529bae2562cd9c70", "details": {}, "granularity": "field", "snapshot_ref": "baseline://sha256/269384f9843b5f39573e5e65daf0aa0c1ffdf2a09051cbe84cb59567d80e51e8", "source": "resource://architecture/overview#/title", "source_kind": "raw", "validated_version": "a4584dcc35db9b04ac02acc3a2655e6d7390d20b05de7083529bae2562cd9c70"}, {"baseline_hash": "sha256:cbbbf3a61731a5dc8a3cf740f1a5459caba4f03c44599a88a2dd2d280c0548cc", "changed": false, "comparator": "exact", "current_source_kind": "raw", "current_version": "9cc97ae5dc70a3abe20ca11caf0f1e6848bd7a57811f9548b665c93fcf1ab3f5", "details": {}, "granularity": "field", "snapshot_ref": "baseline://sha256/cbbbf3a61731a5dc8a3cf740f1a5459caba4f03c44599a88a2dd2d280c0548cc", "source": "resource://policies/method_policy#/allowed_methods", "source_kind": "raw", "validated_version": "9cc97ae5dc70a3abe20ca11caf0f1e6848bd7a57811f9548b665c93fcf1ab3f5"}], "dependency_type": "aggregate", "reason_codes": [], "receipt_id": "receipt-f4855ccad64a3c4ee45a038ff909b736c3c81804cf8257f637e5b5cb9ee4c706", "target": "resource://architecture/system_summary", "target_revision": null}, "state_changed": false, "status": "valid", "target": "resource://architecture/system_summary"}]}, "invalid_targets": [], "materialization": {"results": [], "state_changed": false, "state_revision": 1, "written": 0}, "mixed_sccs": [], "ok": true, "orphaned_materializations": [], "rebuilt": [], "roots": {"documentation_root": "/mnt/data/docengine_p6_clean_projects/sample/docs", "project_root": "/mnt/data/docengine_p6_clean_projects/sample", "source": "explicit"}, "status": "ok", "unresolved_builds": []}, "errors": [], "meta": {"engine_version": "0.1.0.dev12", "exit_code": 0, "status": "ok"}, "ok": true, "schema_version": "2.0.0", "warnings": []}
