{"attention_required": true, "command": "status", "data": {}, "errors": [{"code": "recovery_required", "details": null, "message": "interrupted transaction requires recovery before read: txn-rogue", "severity": "error"}], "meta": {"engine_version": "0.1.0.dev15", "exit_code": 3, "status": "recovery_required"}, "ok": false, "schema_version": "2.0.0", "warnings": []}
