{"attention_required": true, "command": "verify", "data": {"report": {"findings": [{"code": "dependency_runtime_unavailable", "message": "dependency runtime directory must not be a symlink", "severity": "blocking"}], "ok": false, "sections": {"current_checks": {"error": "dependency runtime directory must not be a symlink"}, "dependency_integrity": {"issues": [{"code": "dependency_runtime_unavailable", "message": "dependency runtime directory must not be a symlink"}], "ok": false, "receipt_count": 0}, "dependency_runtime": {"error": "dependency runtime directory must not be a symlink", "ok": false}, "dependency_state": {"error": "dependency runtime directory must not be a symlink"}, "materialization": {"error": "dependency runtime directory must not be a symlink"}, "required_builders": [{"audit_complete": true, "output_digest": "aad015b1b1a5a30b84861d6fec384a28fcb038f496b37ac975ecffde5fe731f3", "recorded_receipt_id": null, "status": "evidence_unavailable", "target": "resource://catalog/price_with_tax"}], "semantic_rules": []}, "summary": {"blocking_findings": 1, "total_findings": 1, "warnings": 0}}, "roots": {"documentation_root": "/tmp/tmp.DM0pHloveU/project/docs", "project_root": "/tmp/tmp.DM0pHloveU/project", "source": "explicit"}}, "errors": [], "meta": {"engine_version": "0.1.0.dev13", "exit_code": 3, "status": "verification_failed"}, "ok": false, "schema_version": "2.0.0", "warnings": []}
