{"attention_required": true, "command": "verify", "data": {"report": {"findings": [{"code": "current_dependency_change", "details": {"reason_codes": ["dependency_changed"]}, "message": "current evidence classifies target as build_required", "severity": "blocking", "target": "resource://catalog/price_with_tax"}, {"code": "materialization_not_current", "details": {"drift": false, "error": "derived materialization requires rebuild/check before rendering changed target: resource://catalog/price_with_tax", "needs_materialization": false, "outdated": false, "owner_ref": "resource://catalog/price_with_tax", "registered": true, "renderer": "markdown", "state": "error"}, "message": "generated view state is error", "severity": "blocking", "target": "file://catalog/price_with_tax.md"}, {"code": "materialization_not_current", "details": {"current_digest": "sha256:4f44713ab1cdbc579dcf8ee20e931ca08d891ffe5cd2843941f220ef2c819666", "drift": false, "expected_digest": "sha256:4f44713ab1cdbc579dcf8ee20e931ca08d891ffe5cd2843941f220ef2c819666", "input_revision": "ab7744dd7004c5ef2590c948bd8923848a768f259d88a4063b270c745f6c497a", "needs_materialization": true, "outdated": true, "owner_ref": "resource://catalog/product", "registered": true, "renderer": "markdown", "renderer_revision": "builtin:markdown:v1", "state": "outdated"}, "message": "generated view state is outdated", "severity": "blocking", "target": "file://catalog/product.md"}, {"code": "required_builder_output_mismatch", "details": {"current": "07826ce10d60d228b9211403de3f30e5cf772049da4139041a59bfe90cc98151", "recorded": "aad015b1b1a5a30b84861d6fec384a28fcb038f496b37ac975ecffde5fe731f3"}, "message": "current deterministic output differs from recorded receipt", "severity": "blocking", "target": "resource://catalog/price_with_tax"}], "ok": false, "sections": {"current_checks": [{"changed_dependencies": ["resource://catalog/product#/price"], "kind": "dependency", "reason_codes": ["dependency_changed"], "status": "build_required", "target": "resource://catalog/price_with_tax"}], "dependency_integrity": {"issues": [], "ok": true, "receipt_count": 1}, "dependency_runtime": {"ok": true}, "dependency_state": {"counts": {"valid": 1}, "generated_at": "2026-10-02T00:39:16.257209Z", "targets": {"resource://catalog/price_with_tax": {"changed_dependencies": [], "last_receipt_id": "receipt-7ec1b38016c179027b2697a77751343e75b384326f4fab1ad67975244ec1ea4d", "reason_codes": [], "status": "valid"}}}, "hardening": {"migration": {"current": true, "marker": {"migrated_at": "2026-10-02T05:53:57.360112Z", "migrated_from": "legacy-p6-unmarked", "migration_id": "p6-unmarked-to-runtime-layout-1", "preserved_evidence_digest": "sha256:f66cff7bce40c61c055f8f30e7a403a8d0cdb2bcdea6611feda5730a62cf1c87", "preserved_file_count": 6, "runtime_layout_version": "1.0.0"}, "migration_required": false, "target_version": "1.0.0", "version": "1.0.0"}, "pending_transactions": []}, "materialization": {"drifted": 0, "errors": 1, "needs_materialization": 1, "orphans": [], "outdated": 1, "outputs": [{"drift": false, "error": "derived materialization requires rebuild/check before rendering changed target: resource://catalog/price_with_tax", "needs_materialization": false, "outdated": false, "owner_ref": "resource://catalog/price_with_tax", "path": "catalog/price_with_tax.md", "registered": true, "renderer": "markdown", "state": "error"}, {"current_digest": "sha256:4f44713ab1cdbc579dcf8ee20e931ca08d891ffe5cd2843941f220ef2c819666", "drift": false, "expected_digest": "sha256:4f44713ab1cdbc579dcf8ee20e931ca08d891ffe5cd2843941f220ef2c819666", "input_revision": "ab7744dd7004c5ef2590c948bd8923848a768f259d88a4063b270c745f6c497a", "needs_materialization": true, "outdated": true, "owner_ref": "resource://catalog/product", "path": "catalog/product.md", "registered": true, "renderer": "markdown", "renderer_revision": "builtin:markdown:v1", "state": "outdated"}, {"current_digest": "sha256:2fa48f19b9252e2b9be879f26e0850ffed7dc5f2ff4c18fc1551178d552c4977", "drift": false, "expected_digest": "sha256:2fa48f19b9252e2b9be879f26e0850ffed7dc5f2ff4c18fc1551178d552c4977", "input_revision": "b77cb44212d83ff513e80b28b75131fa2b7534f237efb066cdadbe8a99b60878", "needs_materialization": false, "outdated": false, "owner_ref": "resource://catalog/tax_policy", "path": "catalog/tax_policy.md", "registered": true, "renderer": "markdown", "renderer_revision": "builtin:markdown:v1", "state": "current"}], "unresolved_orphans": 0}, "required_builders": [{"audit_complete": true, "output_digest": "07826ce10d60d228b9211403de3f30e5cf772049da4139041a59bfe90cc98151", "recorded_receipt_id": "receipt-7ec1b38016c179027b2697a77751343e75b384326f4fab1ad67975244ec1ea4d", "status": "build_required", "target": "resource://catalog/price_with_tax"}], "semantic_rules": []}, "summary": {"blocking_findings": 4, "total_findings": 4, "warnings": 0}}, "roots": {"documentation_root": "/mnt/data/docengine_p7_clean_projects/crash/docs", "project_root": "/mnt/data/docengine_p7_clean_projects/crash", "source": "explicit"}}, "errors": [], "meta": {"engine_version": "0.1.0.dev14", "exit_code": 3, "status": "verification_failed"}, "ok": false, "schema_version": "2.0.0", "warnings": []}
