{"attention_required": true, "command": "recover", "data": {}, "errors": [{"code": "recovery_required", "details": null, "message": "transaction target changed outside interrupted operation; refusing overwrite: catalog/product.md", "severity": "error"}], "meta": {"engine_version": "0.1.0.dev15", "exit_code": 3, "status": "recovery_required"}, "ok": false, "schema_version": "2.0.0", "warnings": []}
