{"attention_required": true, "command": "status", "data": {}, "errors": [{"code": "recovery_required", "details": null, "message": "interrupted transaction requires recovery before read: txn-8a3d7369-2a2c-4d85-acaf-34f8e77fa22e", "severity": "error"}], "meta": {"engine_version": "0.1.0.dev14", "exit_code": 3, "status": "recovery_required"}, "ok": false, "schema_version": "2.0.0", "warnings": []}
