{"attention_required": true, "command": "status", "data": {}, "errors": [{"code": "runtime_busy", "details": null, "message": "documentation runtime is busy with another reader: /tmp/docengine-runtime-locks/2d2fd3b002e7753c229cb247d29485fd1d4c710c345232e97eea17f19d5435b3.lock", "severity": "error"}], "meta": {"engine_version": "0.1.0.dev14", "exit_code": 3, "status": "runtime_busy"}, "ok": false, "schema_version": "2.0.0", "warnings": []}
