{"attention_required": true, "command": "status", "data": {}, "errors": [{"code": "recovery_required", "details": null, "message": "interrupted transaction requires recovery before read: txn-dc20b58b-552f-4214-9890-4754566085a9", "severity": "error"}], "meta": {"engine_version": "0.1.0.dev14", "exit_code": 3, "status": "recovery_required"}, "ok": false, "schema_version": "2.0.0", "warnings": []}
